Unnamed: 0,name,mapped_data
15930,dare county north carolina united states,",Dare County,North Carolina,United States"
15931,caldwell county north carolina united states,",Caldwell County,North Carolina,United States"
15932,camden county north carolina united states,",Camden County,North Carolina,United States"
15933,haywood county north carolina united states,",Haywood County,North Carolina,United States"
15934,orange county north carolina united states,",Orange County,North Carolina,United States"
15935,mecklenburg county north carolina united states,",Mecklenburg County,North Carolina,United States"
15936,rowan county north carolina united states,",Rowan County,North Carolina,United States"
15937,catawba county north carolina united states,",Catawba County,North Carolina,United States"
15938,forsyth county north carolina united states,",Forsyth County,North Carolina,United States"
15939,sampson county north carolina united states,",Sampson County,North Carolina,United States"
15940,tyrrell county north carolina united states,",Tyrrell County,North Carolina,United States"
15941,polk county north carolina united states,",Polk County,North Carolina,United States"
15942,cabarrus county north carolina united states,",Cabarrus County,North Carolina,United States"
15943,burke county north carolina united states,",Burke County,North Carolina,United States"
15944,richmond county north carolina united states,",Richmond County,North Carolina,United States"
15945,wilkes county north carolina united states,",Wilkes County,North Carolina,United States"
15946,jackson county north carolina united states,",Jackson County,North Carolina,United States"
15947,currituck county north carolina united states,",Currituck County,North Carolina,United States"
15948,stokes county north carolina united states,",Stokes County,North Carolina,United States"
15949,davidson county north carolina united states,",Davidson County,North Carolina,United States"
15950,lincoln county north carolina united states,",Lincoln County,North Carolina,United States"
15951,surry county north carolina united states,",Surry County,North Carolina,United States"
15952,durham county north carolina united states,",Durham County,North Carolina,United States"
15953,cumberland county north carolina united states,",Cumberland County,North Carolina,United States"
15954,rockingham county north carolina united states,",Rockingham County,North Carolina,United States"
15955,chowan county north carolina united states,",Chowan County,North Carolina,United States"
15956,pasquotank county north carolina united states,",Pasquotank County,North Carolina,United States"
15957,wilson county north carolina united states,",Wilson County,North Carolina,United States"
15958,halifax county north carolina united states,",Halifax County,North Carolina,United States"
15959,robeson county north carolina united states,",Robeson County,North Carolina,United States"
15960,union county north carolina united states,",Union County,North Carolina,United States"
15961,chatham county north carolina united states,",Chatham County,North Carolina,United States"
15962,rutherford county north carolina united states,",Rutherford County,North Carolina,United States"
15963,guilford county north carolina united states,",Guilford County,North Carolina,United States"
15964,macon county north carolina united states,",Macon County,North Carolina,United States"
15965,franklin county north carolina united states,",Franklin County,North Carolina,United States"
15966,northampton county north carolina united states,",Northampton County,North Carolina,United States"
15967,gates county north carolina united states,",Gates County,North Carolina,United States"
15968,onslow county north carolina united states,",Onslow County,North Carolina,United States"
15969,clay county north carolina united states,",Clay County,North Carolina,United States"
15970,vance county north carolina united states,",Vance County,North Carolina,United States"
15971,perquimans county north carolina united states,",Perquimans County,North Carolina,United States"
15972,ashe county north carolina united states,",Ashe County,North Carolina,United States"
15973,lenoir county north carolina united states,",Lenoir County,North Carolina,United States"
15974,scotland county north carolina united states,",Scotland County,North Carolina,United States"
15975,mcdowell county north carolina united states,",McDowell County,North Carolina,United States"
15976,madison county north carolina united states,",Madison County,North Carolina,United States"
15977,greene county north carolina united states,",Greene County,North Carolina,United States"
15978,jones county north carolina united states,",Jones County,North Carolina,United States"
15979,iredell county north carolina united states,",Iredell County,North Carolina,United States"
15980,nash county north carolina united states,",Nash County,North Carolina,United States"
15981,warren county north carolina united states,",Warren County,North Carolina,United States"
15982,edgecombe county north carolina united states,",Edgecombe County,North Carolina,United States"
15983,washington county north carolina united states,",Washington County,North Carolina,United States"
15984,hoke county north carolina united states,",Hoke County,North Carolina,United States"
15985,graham county north carolina united states,",Graham County,North Carolina,United States"
15986,martin county north carolina united states,",Martin County,North Carolina,United States"
15987,person county north carolina united states,",Person County,North Carolina,United States"
15988,alleghany county north carolina united states,",Alleghany County,North Carolina,United States"
15989,hyde county north carolina united states,",Hyde County,North Carolina,United States"
15990,bertie county north carolina united states,",Bertie County,North Carolina,United States"
15991,caswell county north carolina united states,",Caswell County,North Carolina,United States"
15992,atlantic county new jersey united states,",Atlantic County,New Jersey,United States"
15993,salem county new jersey united states,",Salem County,New Jersey,United States"
15994,camden county new jersey united states,",Camden County,New Jersey,United States"
15995,cape may county new jersey united states,",Cape May County,New Jersey,United States"
15996,ocean county new jersey united states,",Ocean County,New Jersey,United States"
15997,gloucester county new jersey united states,",Gloucester County,New Jersey,United States"
15998,cumberland county new jersey united states,",Cumberland County,New Jersey,United States"
15999,burlington county new jersey united states,",Burlington County,New Jersey,United States"
16000,brown county ohio united states,",Brown County,Ohio,United States"
16001,clermont county ohio united states,",Clermont County,Ohio,United States"
16002,darke county ohio united states,",Darke County,Ohio,United States"
16003,pickaway county ohio united states,",Pickaway County,Ohio,United States"
16004,athens county ohio united states,",Athens County,Ohio,United States"
16005,fairfield county ohio united states,",Fairfield County,Ohio,United States"
16006,belmont county ohio united states,",Belmont County,Ohio,United States"
16007,greene county ohio united states,",Greene County,Ohio,United States"
16008,butler county ohio united states,",Butler County,Ohio,United States"
16009,washington county ohio united states,",Washington County,Ohio,United States"
16010,madison county ohio united states,",Madison County,Ohio,United States"
16011,franklin county ohio united states,",Franklin County,Ohio,United States"
16012,clinton county ohio united states,",Clinton County,Ohio,United States"
16013,montgomery county ohio united states,",Montgomery County,Ohio,United States"
16014,licking county ohio united states,",Licking County,Ohio,United States"
16015,lawrence county ohio united states,",Lawrence County,Ohio,United States"
16016,guernsey county ohio united states,",Guernsey County,Ohio,United States"
16017,noble county ohio united states,",Noble County,Ohio,United States"
16018,preble county ohio united states,",Preble County,Ohio,United States"
16019,warren county ohio united states,",Warren County,Ohio,United States"
16020,perry county ohio united states,",Perry County,Ohio,United States"
16021,clark county ohio united states,",Clark County,Ohio,United States"
16022,ross county ohio united states,",Ross County,Ohio,United States"
16023,scioto county ohio united states,",Scioto County,Ohio,United States"
16024,gallia county ohio united states,",Gallia County,Ohio,United States"
16025,highland county ohio united states,",Highland County,Ohio,United States"
16026,jackson county ohio united states,",Jackson County,Ohio,United States"
16027,fayette county ohio united states,",Fayette County,Ohio,United States"
16028,hocking county ohio united states,",Hocking County,Ohio,United States"
16029,adams county ohio united states,",Adams County,Ohio,United States"
16030,vinton county ohio united states,",Vinton County,Ohio,United States"
16031,morgan county ohio united states,",Morgan County,Ohio,United States"
16032,meigs county ohio united states,",Meigs County,Ohio,United States"
16033,muskingum county ohio united states,",Muskingum County,Ohio,United States"
16034,pike county ohio united states,",Pike County,Ohio,United States"
16035,miami county ohio united states,",Miami County,Ohio,United States"
16036,monroe county ohio united states,",Monroe County,Ohio,United States"
16037,pontotoc county oklahoma united states,",Pontotoc County,Oklahoma,United States"
16038,ottawa county oklahoma united states,",Ottawa County,Oklahoma,United States"
16039,jackson county oklahoma united states,",Jackson County,Oklahoma,United States"
16040,woods county oklahoma united states,",Woods County,Oklahoma,United States"
16041,caddo county oklahoma united states,",Caddo County,Oklahoma,United States"
16042,pushmataha county oklahoma united states,",Pushmataha County,Oklahoma,United States"
16043,custer county oklahoma united states,",Custer County,Oklahoma,United States"
16044,carter county oklahoma united states,",Carter County,Oklahoma,United States"
16045,le flore county oklahoma united states,",Le Flore County,Oklahoma,United States"
16046,ellis county oklahoma united states,",Ellis County,Oklahoma,United States"
16047,atoka county oklahoma united states,",Atoka County,Oklahoma,United States"
16048,osage county oklahoma united states,",Osage County,Oklahoma,United States"
16049,washington county oklahoma united states,",Washington County,Oklahoma,United States"
16050,okmulgee county oklahoma united states,",Okmulgee County,Oklahoma,United States"
16051,oklahoma county oklahoma united states,",Oklahoma County,Oklahoma,United States"
16052,pottawatomie county oklahoma united states,",Pottawatomie County,Oklahoma,United States"
16053,tulsa county oklahoma united states,",Tulsa County,Oklahoma,United States"
16054,kay county oklahoma united states,",Kay County,Oklahoma,United States"
16055,mcclain county oklahoma united states,",McClain County,Oklahoma,United States"
16056,okfuskee county oklahoma united states,",Okfuskee County,Oklahoma,United States"
16057,stephens county oklahoma united states,",Stephens County,Oklahoma,United States"
16058,creek county oklahoma united states,",Creek County,Oklahoma,United States"
16059,mccurtain county oklahoma united states,",McCurtain County,Oklahoma,United States"
16060,harper county oklahoma united states,",Harper County,Oklahoma,United States"
16061,washita county oklahoma united states,",Washita County,Oklahoma,United States"
16062,rogers county oklahoma united states,",Rogers County,Oklahoma,United States"
16063,comanche county oklahoma united states,",Comanche County,Oklahoma,United States"
16064,bryan county oklahoma united states,",Bryan County,Oklahoma,United States"
16065,lincoln county oklahoma united states,",Lincoln County,Oklahoma,United States"
16066,mcintosh county oklahoma united states,",McIntosh County,Oklahoma,United States"
16067,alfalfa county oklahoma united states,",Alfalfa County,Oklahoma,United States"
16068,roger mills county oklahoma united states,",Roger Mills County,Oklahoma,United States"
16069,grady county oklahoma united states,",Grady County,Oklahoma,United States"
16070,mayes county oklahoma united states,",Mayes County,Oklahoma,United States"
16071,delaware county oklahoma united states,",Delaware County,Oklahoma,United States"
16072,pawnee county oklahoma united states,",Pawnee County,Oklahoma,United States"
16073,wagoner county oklahoma united states,",Wagoner County,Oklahoma,United States"
16074,logan county oklahoma united states,",Logan County,Oklahoma,United States"
16075,payne county oklahoma united states,",Payne County,Oklahoma,United States"
16076,murray county oklahoma united states,",Murray County,Oklahoma,United States"
16077,canadian county oklahoma united states,",Canadian County,Oklahoma,United States"
16078,beckham county oklahoma united states,",Beckham County,Oklahoma,United States"
16079,garfield county oklahoma united states,",Garfield County,Oklahoma,United States"
16080,major county oklahoma united states,",Major County,Oklahoma,United States"
16081,muskogee county oklahoma united states,",Muskogee County,Oklahoma,United States"
16082,tillman county oklahoma united states,",Tillman County,Oklahoma,United States"
16083,blaine county oklahoma united states,",Blaine County,Oklahoma,United States"
16084,greer county oklahoma united states,",Greer County,Oklahoma,United States"
16085,cleveland county oklahoma united states,",Cleveland County,Oklahoma,United States"
16086,pittsburg county oklahoma united states,",Pittsburg County,Oklahoma,United States"
16087,kingfisher county oklahoma united states,",Kingfisher County,Oklahoma,United States"
16088,kiowa county oklahoma united states,",Kiowa County,Oklahoma,United States"
16089,hughes county oklahoma united states,",Hughes County,Oklahoma,United States"
16090,harmon county oklahoma united states,",Harmon County,Oklahoma,United States"
16091,choctaw county oklahoma united states,",Choctaw County,Oklahoma,United States"
16092,marshall county oklahoma united states,",Marshall County,Oklahoma,United States"
16093,seminole county oklahoma united states,",Seminole County,Oklahoma,United States"
16094,garvin county oklahoma united states,",Garvin County,Oklahoma,United States"
16095,love county oklahoma united states,",Love County,Oklahoma,United States"
16096,grant county oklahoma united states,",Grant County,Oklahoma,United States"
16097,woodward county oklahoma united states,",Woodward County,Oklahoma,United States"
16098,sequoyah county oklahoma united states,",Sequoyah County,Oklahoma,United States"
16099,nowata county oklahoma united states,",Nowata County,Oklahoma,United States"
16100,cherokee county oklahoma united states,",Cherokee County,Oklahoma,United States"
16101,noble county oklahoma united states,",Noble County,Oklahoma,United States"
16102,jefferson county oklahoma united states,",Jefferson County,Oklahoma,United States"
16103,haskell county oklahoma united states,",Haskell County,Oklahoma,United States"
16104,adair county oklahoma united states,",Adair County,Oklahoma,United States"
16105,dewey county oklahoma united states,",Dewey County,Oklahoma,United States"
16106,cotton county oklahoma united states,",Cotton County,Oklahoma,United States"
16107,johnston county oklahoma united states,",Johnston County,Oklahoma,United States"
16108,craig county oklahoma united states,",Craig County,Oklahoma,United States"
16109,latimer county oklahoma united states,",Latimer County,Oklahoma,United States"
16110,adams county pennsylvania united states,",Adams County,Pennsylvania,United States"
16111,delaware county pennsylvania united states,",Delaware County,Pennsylvania,United States"
16112,chester county pennsylvania united states,",Chester County,Pennsylvania,United States"
16113,somerset county pennsylvania united states,",Somerset County,Pennsylvania,United States"
16114,franklin county pennsylvania united states,",Franklin County,Pennsylvania,United States"
16115,lancaster county pennsylvania united states,",Lancaster County,Pennsylvania,United States"
16116,york county pennsylvania united states,",York County,Pennsylvania,United States"
16117,fayette county pennsylvania united states,",Fayette County,Pennsylvania,United States"
16118,greene county pennsylvania united states,",Greene County,Pennsylvania,United States"
16119,fulton county pennsylvania united states,",Fulton County,Pennsylvania,United States"
16120,montgomery county pennsylvania united states,",Montgomery County,Pennsylvania,United States"
16121,philadelphia county pennsylvania united states,",Philadelphia County,Pennsylvania,United States"
16122,abbeville county south carolina united states,",Abbeville County,South Carolina,United States"
16123,aiken county south carolina united states,",Aiken County,South Carolina,United States"
16124,allendale county south carolina united states,",Allendale County,South Carolina,United States"
16125,anderson county south carolina united states,",Anderson County,South Carolina,United States"
16126,williamsburg county south carolina united states,",Williamsburg County,South Carolina,United States"
16127,spartanburg county south carolina united states,",Spartanburg County,South Carolina,United States"
16128,pickens county south carolina united states,",Pickens County,South Carolina,United States"
16129,charleston county south carolina united states,",Charleston County,South Carolina,United States"
16130,bamberg county south carolina united states,",Bamberg County,South Carolina,United States"
16131,barnwell county south carolina united states,",Barnwell County,South Carolina,United States"
16132,lexington county south carolina united states,",Lexington County,South Carolina,United States"
16133,beaufort county south carolina united states,",Beaufort County,South Carolina,United States"
16134,marlboro county south carolina united states,",Marlboro County,South Carolina,United States"
16135,greenville county south carolina united states,",Greenville County,South Carolina,United States"
16136,lee county south carolina united states,",Lee County,South Carolina,United States"
16137,cherokee county south carolina united states,",Cherokee County,South Carolina,United States"
16138,richland county south carolina united states,",Richland County,South Carolina,United States"
16139,berkeley county south carolina united states,",Berkeley County,South Carolina,United States"
16140,orangeburg county south carolina united states,",Orangeburg County,South Carolina,United States"
16141,union county south carolina united states,",Union County,South Carolina,United States"
16142,sumter county south carolina united states,",Sumter County,South Carolina,United States"
16143,york county south carolina united states,",York County,South Carolina,United States"
16144,dorchester county south carolina united states,",Dorchester County,South Carolina,United States"
16145,chesterfield county south carolina united states,",Chesterfield County,South Carolina,United States"
16146,chester county south carolina united states,",Chester County,South Carolina,United States"
16147,laurens county south carolina united states,",Laurens County,South Carolina,United States"
16148,horry county south carolina united states,",Horry County,South Carolina,United States"
16149,darlington county south carolina united states,",Darlington County,South Carolina,United States"
16150,dillon county south carolina united states,",Dillon County,South Carolina,United States"
16151,edgefield county south carolina united states,",Edgefield County,South Carolina,United States"
16152,lancaster county south carolina united states,",Lancaster County,South Carolina,United States"
16153,hampton county south carolina united states,",Hampton County,South Carolina,United States"
16154,florence county south carolina united states,",Florence County,South Carolina,United States"
16155,georgetown county south carolina united states,",Georgetown County,South Carolina,United States"
16156,greenwood county south carolina united states,",Greenwood County,South Carolina,United States"
16157,jasper county south carolina united states,",Jasper County,South Carolina,United States"
16158,clarendon county south carolina united states,",Clarendon County,South Carolina,United States"
16159,marion county south carolina united states,",Marion County,South Carolina,United States"
16160,mccormick county south carolina united states,",McCormick County,South Carolina,United States"
16161,newberry county south carolina united states,",Newberry County,South Carolina,United States"
16162,calhoun county south carolina united states,",Calhoun County,South Carolina,United States"
16163,saluda county south carolina united states,",Saluda County,South Carolina,United States"
16164,oconee county south carolina united states,",Oconee County,South Carolina,United States"
16165,colleton county south carolina united states,",Colleton County,South Carolina,United States"
16166,fairfield county south carolina united states,",Fairfield County,South Carolina,United States"
16167,mcnairy county tennessee united states,",McNairy County,Tennessee,United States"
16168,crockett county tennessee united states,",Crockett County,Tennessee,United States"
16169,blount county tennessee united states,",Blount County,Tennessee,United States"
16170,putnam county tennessee united states,",Putnam County,Tennessee,United States"
16171,grundy county tennessee united states,",Grundy County,Tennessee,United States"
16172,hamilton county tennessee united states,",Hamilton County,Tennessee,United States"
16173,giles county tennessee united states,",Giles County,Tennessee,United States"
16174,shelby county tennessee united states,",Shelby County,Tennessee,United States"
16175,cheatham county tennessee united states,",Cheatham County,Tennessee,United States"
16176,mcminn county tennessee united states,",McMinn County,Tennessee,United States"
16177,tipton county tennessee united states,",Tipton County,Tennessee,United States"
16178,unicoi county tennessee united states,",Unicoi County,Tennessee,United States"
16179,grainger county tennessee united states,",Grainger County,Tennessee,United States"
16180,davidson county tennessee united states,",Davidson County,Tennessee,United States"
16181,polk county tennessee united states,",Polk County,Tennessee,United States"
16182,sullivan county tennessee united states,",Sullivan County,Tennessee,United States"
16183,hardeman county tennessee united states,",Hardeman County,Tennessee,United States"
16184,hickman county tennessee united states,",Hickman County,Tennessee,United States"
16185,gibson county tennessee united states,",Gibson County,Tennessee,United States"
16186,williamson county tennessee united states,",Williamson County,Tennessee,United States"
16187,lincoln county tennessee united states,",Lincoln County,Tennessee,United States"
16188,haywood county tennessee united states,",Haywood County,Tennessee,United States"
16189,carroll county tennessee united states,",Carroll County,Tennessee,United States"
16190,dickson county tennessee united states,",Dickson County,Tennessee,United States"
16191,pickett county tennessee united states,",Pickett County,Tennessee,United States"
16192,benton county tennessee united states,",Benton County,Tennessee,United States"
16193,smith county tennessee united states,",Smith County,Tennessee,United States"
16194,campbell county tennessee united states,",Campbell County,Tennessee,United States"
16195,clay county tennessee united states,",Clay County,Tennessee,United States"
16196,carter county tennessee united states,",Carter County,Tennessee,United States"
16197,lauderdale county tennessee united states,",Lauderdale County,Tennessee,United States"
16198,marshall county tennessee united states,",Marshall County,Tennessee,United States"
16199,hawkins county tennessee united states,",Hawkins County,Tennessee,United States"
16200,montgomery county tennessee united states,",Montgomery County,Tennessee,United States"
16201,bradley county tennessee united states,",Bradley County,Tennessee,United States"
16202,wayne county tennessee united states,",Wayne County,Tennessee,United States"
16203,anderson county tennessee united states,",Anderson County,Tennessee,United States"
16204,morgan county tennessee united states,",Morgan County,Tennessee,United States"
16205,maury county tennessee united states,",Maury County,Tennessee,United States"
16206,union county tennessee united states,",Union County,Tennessee,United States"
16207,robertson county tennessee united states,",Robertson County,Tennessee,United States"
16208,franklin county tennessee united states,",Franklin County,Tennessee,United States"
16209,cumberland county tennessee united states,",Cumberland County,Tennessee,United States"
16210,hardin county tennessee united states,",Hardin County,Tennessee,United States"
16211,jefferson county tennessee united states,",Jefferson County,Tennessee,United States"
16212,rhea county tennessee united states,",Rhea County,Tennessee,United States"
16213,meigs county tennessee united states,",Meigs County,Tennessee,United States"
16214,decatur county tennessee united states,",Decatur County,Tennessee,United States"
16215,jackson county tennessee united states,",Jackson County,Tennessee,United States"
16216,stewart county tennessee united states,",Stewart County,Tennessee,United States"
16217,weakley county tennessee united states,",Weakley County,Tennessee,United States"
16218,sequatchie county tennessee united states,",Sequatchie County,Tennessee,United States"
16219,dyer county tennessee united states,",Dyer County,Tennessee,United States"
16220,obion county tennessee united states,",Obion County,Tennessee,United States"
