Unnamed: 0,name,mapped_data
18058,wade hampton census area alaska united states,",Wade Hampton Census Area,Alaska,United States"
18059,kodiak island borough alaska united states,",Kodiak Island Borough,Alaska,United States"
18060,northwest arctic borough alaska united states,",Northwest Arctic Borough,Alaska,United States"
18061,nome census area alaska united states,",Nome Census Area,Alaska,United States"
18062,north slope borough alaska united states,",North Slope Borough,Alaska,United States"
18063,aleutians east borough alaska united states,",Aleutians East Borough,Alaska,United States"
18064,southeast fairbanks census area alaska united states,",Southeast Fairbanks Census Area,Alaska,United States"
18065,bethel census area alaska united states,",Bethel Census Area,Alaska,United States"
18066,james city county virginia united states,",James City County,Virginia,United States"
18340,"municipio la canada de urdaneta zulia venezuela, bolivarian rep. of",",Municipio La Canada de Urdaneta,Zulia,Venezuela, Bolivarian Rep. of"
18839,city of johannesburg metropolitan municipality gauteng south africa,",City of Johannesburg Metropolitan Municipality,Gauteng,South Africa"
18840,ngaka modiri molema district municipality north-west south africa,",Ngaka Modiri Molema District Municipality,North-West,South Africa"
18841,xhariep district municipality orange free state south africa,",Xhariep District Municipality,Orange Free State,South Africa"
18842,dr kenneth kaunda district municipality north-west south africa,",Dr Kenneth Kaunda District Municipality,North-West,South Africa"
18843,ehlanzeni district mpumalanga south africa,",Ehlanzeni District,Mpumalanga,South Africa"
18844,nkangala district municipality mpumalanga south africa,",Nkangala District Municipality,Mpumalanga,South Africa"
18845,lejweleputswa district municipality orange free state south africa,",Lejweleputswa District Municipality,Orange Free State,South Africa"
18846,cacadu district municipality eastern cape south africa,",Cacadu District Municipality,Eastern Cape,South Africa"
18847,namakwa district municipality northern cape south africa,",Namakwa District Municipality,Northern Cape,South Africa"
18848,chris hani district municipality eastern cape south africa,",Chris Hani District Municipality,Eastern Cape,South Africa"
18849,west rand district municipality gauteng south africa,",West Rand District Municipality,Gauteng,South Africa"
18850,umgungundlovu district municipality kwazulu-natal south africa,",uMgungundlovu District Municipality,KwaZulu-Natal,South Africa"
18851,frances baard district municipality northern cape south africa,",Frances Baard District Municipality,Northern Cape,South Africa"
18852,waterberg district municipality limpopo south africa,",Waterberg District Municipality,Limpopo,South Africa"
18853,zululand district municipality kwazulu-natal south africa,",Zululand District Municipality,KwaZulu-Natal,South Africa"
18854,dr ruth segomotsi mompati district municipality north-west south africa,",Dr Ruth Segomotsi Mompati District Municipality,North-West,South Africa"
18855,fezile dabi district municipality orange free state south africa,",Fezile Dabi District Municipality,Orange Free State,South Africa"
18856,thabo mofutsanyana district municipality orange free state south africa,",Thabo Mofutsanyana District Municipality,Orange Free State,South Africa"
18857,gert sibande district municipality mpumalanga south africa,",Gert Sibande District Municipality,Mpumalanga,South Africa"
18858,pixley ka seme district municipality northern cape south africa,",Pixley ka Seme District Municipality,Northern Cape,South Africa"
18859,sedibeng district municipality gauteng south africa,",Sedibeng District Municipality,Gauteng,South Africa"
18860,amajuba district municipality kwazulu-natal south africa,",Amajuba District Municipality,KwaZulu-Natal,South Africa"
18861,siyanda district municipality northern cape south africa,",Siyanda District Municipality,Northern Cape,South Africa"
18862,or tambo district municipality eastern cape south africa,",OR Tambo District Municipality,Eastern Cape,South Africa"
18863,ethekwini metropolitan municipality kwazulu-natal south africa,",eThekwini Metropolitan Municipality,KwaZulu-Natal,South Africa"
18864,nelson mandela bay metropolitan municipality eastern cape south africa,",Nelson Mandela Bay Metropolitan Municipality,Eastern Cape,South Africa"
18865,mopani district municipality limpopo south africa,",Mopani District Municipality,Limpopo,South Africa"
18866,umzinyathi district municipality kwazulu-natal south africa,",uMzinyathi District Municipality,KwaZulu-Natal,South Africa"
18867,  limpopo south africa,", ,Limpopo,South Africa"
18868,vhembe district municipality limpopo south africa,",Vhembe District Municipality,Limpopo,South Africa"
18869,mangaung metropolitan municipality orange free state south africa,",Mangaung Metropolitan Municipality,Orange Free State,South Africa"
18870,ekurhuleni metropolitan municipality gauteng south africa,",Ekurhuleni Metropolitan Municipality,Gauteng,South Africa"
18871,overberg district municipality western cape south africa,",Overberg District Municipality,Western Cape,South Africa"
18872,ilembe district municipality kwazulu-natal south africa,",iLembe District Municipality,KwaZulu-Natal,South Africa"
18873,amathole district municipality eastern cape south africa,",Amathole District Municipality,Eastern Cape,South Africa"
18874,ugu district municipality kwazulu-natal south africa,",Ugu District Municipality,KwaZulu-Natal,South Africa"
18875,bojanala platinum district municipality north-west south africa,",Bojanala Platinum District Municipality,North-West,South Africa"
18876,eden district municipality western cape south africa,",Eden District Municipality,Western Cape,South Africa"
18877,uthungulu district municipality kwazulu-natal south africa,",uThungulu District Municipality,KwaZulu-Natal,South Africa"
18878,central karoo district municipality western cape south africa,",Central Karoo District Municipality,Western Cape,South Africa"
18879,city of tshwane metropolitan municipality gauteng south africa,",City of Tshwane Metropolitan Municipality,Gauteng,South Africa"
18880,capricorn district municipality limpopo south africa,",Capricorn District Municipality,Limpopo,South Africa"
18881,  north-west south africa,", ,North-West,South Africa"
18882,umkhanyakude district municipality kwazulu-natal south africa,",uMkhanyakude District Municipality,KwaZulu-Natal,South Africa"
18883,alfred nzo district municipality eastern cape south africa,",Alfred Nzo District Municipality,Eastern Cape,South Africa"
18884,  kwazulu-natal south africa,", ,KwaZulu-Natal,South Africa"
18885,  mpumalanga south africa,", ,Mpumalanga,South Africa"
18886,joe gqabi district municipality eastern cape south africa,",Joe Gqabi District Municipality,Eastern Cape,South Africa"
18887,uthukela district municipality kwazulu-natal south africa,",uThukela District Municipality,KwaZulu-Natal,South Africa"
18888,john taolo gaetsewe district municipality northern cape south africa,",John Taolo Gaetsewe District Municipality,Northern Cape,South Africa"
18889,sisonke district municipality kwazulu-natal south africa,",Sisonke District Municipality,KwaZulu-Natal,South Africa"
18890,sekhukhune district municipality limpopo south africa,",Sekhukhune District Municipality,Limpopo,South Africa"
18891,buffalo city metropolitan municipality eastern cape south africa,",Buffalo City Metropolitan Municipality,Eastern Cape,South Africa"
18892,cape winelands district municipality western cape south africa,",Cape Winelands District Municipality,Western Cape,South Africa"
18893,west coast district municipality western cape south africa,",West Coast District Municipality,Western Cape,South Africa"
18894,city of cape town western cape south africa,",City of Cape Town,Western Cape,South Africa"
34984,western australia york australia,",York,Western Australia,Australia"
34985,western australia wanneroo australia,",Wanneroo,Western Australia,Australia"
34986,western australia busselton australia,",Busselton,Western Australia,Australia"
34987,western australia northam australia,",Northam,Western Australia,Australia"
34988,western australia mundaring australia,",Mundaring,Western Australia,Australia"
34989,south australia charles sturt australia,",Charles Sturt,South Australia,Australia"
34990,south australia adelaide hills australia,",Adelaide Hills,South Australia,Australia"
34991,western australia wongan-ballidu australia,",Wongan-Ballidu,Western Australia,Australia"
34992,south australia barossa australia,",Barossa,South Australia,Australia"
34993,south australia light australia,",Light,South Australia,Australia"
34994,south australia whyalla australia,",Whyalla,South Australia,Australia"
34995,western australia cambridge australia,",Cambridge,Western Australia,Australia"
34996,western australia kwinana australia,",Kwinana,Western Australia,Australia"
34997,south australia unley australia,",Unley,South Australia,Australia"
34998,western australia waroona australia,",Waroona,Western Australia,Australia"
34999,south australia copper coast australia,",Copper Coast,South Australia,Australia"
35000,south australia loxton waikerie australia,",Loxton Waikerie,South Australia,Australia"
35001,western australia wagin australia,",Wagin,Western Australia,Australia"
35002,western australia geraldton-greenough australia,",Geraldton-Greenough,Western Australia,Australia"
35003,south australia playford australia,",Playford,South Australia,Australia"
35004,south australia victor harbor australia,",Victor Harbor,South Australia,Australia"
35005,south australia mallala australia,",Mallala,South Australia,Australia"
35006,south australia tumby bay australia,",Tumby Bay,South Australia,Australia"
35007,western australia stirling australia,",Stirling,Western Australia,Australia"
35008,western australia toodyay australia,",Toodyay,Western Australia,Australia"
35009,south australia city of west torrens australia,",City of West Torrens,South Australia,Australia"
35010,northern territory barkly australia,",Barkly,Northern Territory,Australia"
35011,south australia murray bridge australia,",Murray Bridge,South Australia,Australia"
35012,western australia nedlands australia,",Nedlands,Western Australia,Australia"
35013,south australia marion australia,",Marion,South Australia,Australia"
35014,south australia streaky bay australia,",Streaky Bay,South Australia,Australia"
35015,south australia alexandrina australia,",Alexandrina,South Australia,Australia"
35016,western australia kalgoorlie/boulder australia,",Kalgoorlie/Boulder,Western Australia,Australia"
35017,western australia city of cockburn australia,",City of Cockburn,Western Australia,Australia"
35018,western australia south perth australia,",South Perth,Western Australia,Australia"
35019,south australia port pirie city and dists australia,",Port Pirie City and Dists,South Australia,Australia"
35020,western australia serpentine-jarrahdale australia,",Serpentine-Jarrahdale,Western Australia,Australia"
35021,south australia onkaparinga australia,",Onkaparinga,South Australia,Australia"
35022,south australia salisbury australia,",Salisbury,South Australia,Australia"
35023,western australia rockingham australia,",Rockingham,Western Australia,Australia"
35024,south australia roxby downs australia,",Roxby Downs,South Australia,Australia"
35025,western australia roebourne australia,",Roebourne,Western Australia,Australia"
35026,western australia kalamunda australia,",Kalamunda,Western Australia,Australia"
35027,western australia ravensthorpe australia,",Ravensthorpe,Western Australia,Australia"
35028,south australia flinders ranges australia,",Flinders Ranges,South Australia,Australia"
35029,south australia prospect australia,",Prospect,South Australia,Australia"
35030,south australia yorke peninsula australia,",Yorke Peninsula,South Australia,Australia"
35031,south australia adelaide australia,",Adelaide,South Australia,Australia"
35032,south australia port lincoln australia,",Port Lincoln,South Australia,Australia"
35033,western australia port hedland australia,",Port Hedland,Western Australia,Australia"
35034,south australia port augusta australia,",Port Augusta,South Australia,Australia"
35035,south australia   australia,", ,South Australia,Australia"
35036,western australia murray australia,",Murray,Western Australia,Australia"
35037,south australia peterborough australia,",Peterborough,South Australia,Australia"
35038,western australia manjimup australia,",Manjimup,Western Australia,Australia"
35039,western australia swan australia,",Swan,Western Australia,Australia"
35040,northern territory darwin australia,",Darwin,Northern Territory,Australia"
35041,western australia fremantle australia,",Fremantle,Western Australia,Australia"
35042,western australia northampton shire australia,",Northampton Shire,Western Australia,Australia"
35043,south australia yankalilla australia,",Yankalilla,South Australia,Australia"
35044,northern territory east arnhem australia,",East Arnhem,Northern Territory,Australia"
35045,western australia east pilbara australia,",East Pilbara,Western Australia,Australia"
35046,western australia narrogin australia,",Narrogin,Western Australia,Australia"
35047,south australia mount barker australia,",Mount Barker,South Australia,Australia"
35048,queensland mount isa australia,",Mount Isa,Queensland,Australia"
35049,western australia plantagenet shire australia,",Plantagenet Shire,Western Australia,Australia"
35050,western australia   australia,", ,Western Australia,Australia"
35051,western australia moora australia,",Moora,Western Australia,Australia"
35052,south australia tea tree gully australia,",Tea Tree Gully,South Australia,Australia"
35053,south australia mitcham australia,",Mitcham,South Australia,Australia"
35054,western australia merredin australia,",Merredin,Western Australia,Australia"
35055,south australia the coorong australia,",The Coorong,South Australia,Australia"
35056,western australia yalgoo australia,",Yalgoo,Western Australia,Australia"
35057,northern territory litchfield australia,",Litchfield,Northern Territory,Australia"
35058,western australia augusta-margaret river shire australia,",Augusta-Margaret River Shire,Western Australia,Australia"
35059,south australia mid murray australia,",Mid Murray,South Australia,Australia"
35060,western australia mandurah australia,",Mandurah,Western Australia,Australia"
35061,western australia gosnells australia,",Gosnells,Western Australia,Australia"
35062,western australia chittering australia,",Chittering,Western Australia,Australia"
35063,western australia wyndham-east kimberley australia,",Wyndham-East Kimberley,Western Australia,Australia"
35064,western australia kojonup australia,",Kojonup,Western Australia,Australia"
35065,south australia kangaroo island australia,",Kangaroo Island,South Australia,Australia"
35066,western australia armadale australia,",Armadale,Western Australia,Australia"
35067,northern territory katherine australia,",Katherine,Northern Territory,Australia"
35068,western australia katanning australia,",Katanning,Western Australia,Australia"
35069,south australia northern areas australia,",Northern Areas,South Australia,Australia"
35070,western australia harvey australia,",Harvey,Western Australia,Australia"
35071,western australia halls creek australia,",Halls Creek,Western Australia,Australia"
35072,western australia albany australia,",Albany,Western Australia,Australia"
35073,south australia port adelaide enfield australia,",Port Adelaide Enfield,South Australia,Australia"
35074,south australia gawler australia,",Gawler,South Australia,Australia"
35075,western australia esperance shire australia,",Esperance Shire,Western Australia,Australia"
35076,western australia donnybrook-balingup australia,",Donnybrook-Balingup,Western Australia,Australia"
35077,western australia irwin australia,",Irwin,Western Australia,Australia"
35078,western australia derby-west kimberley australia,",Derby-West Kimberley,Western Australia,Australia"
35079,western australia denmark australia,",Denmark,Western Australia,Australia"
35080,western australia cunderdin australia,",Cunderdin,Western Australia,Australia"
35081,south australia lower eyre peninsula australia,",Lower Eyre Peninsula,South Australia,Australia"
35082,western australia peppermint grove australia,",Peppermint Grove,Western Australia,Australia"
35083,south australia coober pedy australia,",Coober Pedy,South Australia,Australia"
35084,western australia collie australia,",Collie,Western Australia,Australia"
35085,south australia cleve australia,",Cleve,South Australia,Australia"
35086,south australia clare and gilbert valleys australia,",Clare and Gilbert Valleys,South Australia,Australia"
35087,south australia ceduna australia,",Ceduna,South Australia,Australia"
35088,western australia carnarvon australia,",Carnarvon,Western Australia,Australia"
35089,western australia capel australia,",Capel,Western Australia,Australia"
35090,western australia canning australia,",Canning,Western Australia,Australia"
35091,south australia campbelltown australia,",Campbelltown,South Australia,Australia"
35092,western australia bunbury australia,",Bunbury,Western Australia,Australia"
35093,western australia broome australia,",Broome,Western Australia,Australia"
35094,western australia bridgetown-greenbushes australia,",Bridgetown-Greenbushes,Western Australia,Australia"
35095,western australia boyup brook australia,",Boyup Brook,Western Australia,Australia"
35096,western australia beverley australia,",Beverley,Western Australia,Australia"
35097,south australia burnside australia,",Burnside,South Australia,Australia"
35098,western australia bassendean australia,",Bassendean,Western Australia,Australia"
35099,south australia wakefield australia,",Wakefield,South Australia,Australia"
35100,western australia melville australia,",Melville,Western Australia,Australia"
35101,northern territory alice springs australia,",Alice Springs,Northern Territory,Australia"
35102,western australia dardanup australia,",Dardanup,Western Australia,Australia"
35103,western australia east fremantle australia,",East Fremantle,Western Australia,Australia"
35104,western australia mosman park australia,",Mosman Park,Western Australia,Australia"
35105,western australia claremont australia,",Claremont,Western Australia,Australia"
35106,western australia dandaragan australia,",Dandaragan,Western Australia,Australia"
35107,western australia joondalup australia,",Joondalup,Western Australia,Australia"
35108,northern territory   australia,", ,Northern Territory,Australia"
35109,new south wales young australia,",Young,New South Wales,Australia"
35110,queensland rockhampton australia,",Rockhampton,Queensland,Australia"
35111,queensland gold coast australia,",Gold Coast,Queensland,Australia"
35112,new south wales yass valley australia,",Yass Valley,New South Wales,Australia"
35113,victoria moira australia,",Moira,Victoria,Australia"
35114,victoria maribyrnong australia,",Maribyrnong,Victoria,Australia"
35115,queensland toowoomba australia,",Toowoomba,Queensland,Australia"
35116,victoria yarra ranges australia,",Yarra Ranges,Victoria,Australia"
35117,queensland sunshine coast australia,",Sunshine Coast,Queensland,Australia"
35118,tasmania waratah/wynyard australia,",Waratah/Wynyard,Tasmania,Australia"
35119,queensland brisbane australia,",Brisbane,Queensland,Australia"
35120,south australia grant australia,",Grant,South Australia,Australia"
35121,queensland cairns australia,",Cairns,Queensland,Australia"
35122,queensland moreton bay australia,",Moreton Bay,Queensland,Australia"
35123,new south wales coffs harbour australia,",Coffs Harbour,New South Wales,Australia"
35124,queensland logan australia,",Logan,Queensland,Australia"
35125,queensland south burnett australia,",South Burnett,Queensland,Australia"
35126,victoria wodonga australia,",Wodonga,Victoria,Australia"
35127,victoria   australia,", ,Victoria,Australia"
35128,victoria hobsons bay australia,",Hobsons Bay,Victoria,Australia"
35129,victoria whittlesea australia,",Whittlesea,Victoria,Australia"
35130,new south wales bland australia,",Bland,New South Wales,Australia"
35131,queensland western downs australia,",Western Downs,Queensland,Australia"
35132,tasmania meander valley australia,",Meander Valley,Tasmania,Australia"
35133,victoria wyndham australia,",Wyndham,Victoria,Australia"
35134,queensland redland australia,",Redland,Queensland,Australia"
35135,new south wales wellington australia,",Wellington,New South Wales,Australia"
35136,queensland cook australia,",Cook,Queensland,Australia"
35137,victoria nillumbik australia,",Nillumbik,Victoria,Australia"
35138,queensland southern downs australia,",Southern Downs,Queensland,Australia"
35139,victoria warrnambool australia,",Warrnambool,Victoria,Australia"
35140,tasmania clarence australia,",Clarence,Tasmania,Australia"
35141,victoria manningham australia,",Manningham,Victoria,Australia"
35142,victoria baw baw australia,",Baw Baw,Victoria,Australia"
35143,victoria knox australia,",Knox,Victoria,Australia"
35144,victoria wangaratta australia,",Wangaratta,Victoria,Australia"
35145,queensland mackay australia,",Mackay,Queensland,Australia"
35146,new south wales wagga wagga australia,",Wagga Wagga,New South Wales,Australia"
35147,victoria whitehorse australia,",Whitehorse,Victoria,Australia"
35148,queensland fraser coast australia,",Fraser Coast,Queensland,Australia"
35149,tasmania central coast australia,",Central Coast,Tasmania,Australia"
35150,new south wales shoalhaven shire australia,",Shoalhaven Shire,New South Wales,Australia"
35151,victoria mornington peninsula australia,",Mornington Peninsula,Victoria,Australia"
35152,new south wales tumut shire australia,",Tumut Shire,New South Wales,Australia"
35153,new south wales wyong shire australia,",Wyong Shire,New South Wales,Australia"
35154,victoria hume australia,",Hume,Victoria,Australia"
35155,victoria latrobe australia,",Latrobe,Victoria,Australia"
35156,queensland townsville australia,",Townsville,Queensland,Australia"
35157,victoria casey australia,",Casey,Victoria,Australia"
35158,queensland gladstone australia,",Gladstone,Queensland,Australia"
35159,queensland tablelands australia,",Tablelands,Queensland,Australia"
35160,queensland gympie regional council australia,",Gympie Regional Council,Queensland,Australia"
35161,queensland ipswich australia,",Ipswich,Queensland,Australia"
35162,queensland bundaberg australia,",Bundaberg,Queensland,Australia"
35163,tasmania kingborough australia,",Kingborough,Tasmania,Australia"
35164,queensland banana australia,",Banana,Queensland,Australia"
35165,new south wales greater taree australia,",Greater Taree,New South Wales,Australia"
35166,new south wales tamworth municipality australia,",Tamworth Municipality,New South Wales,Australia"
35167,new south wales city of sydney australia,",City of Sydney,New South Wales,Australia"
35168,victoria brimbank australia,",Brimbank,Victoria,Australia"
35169,victoria swan hill australia,",Swan Hill,Victoria,Australia"
35170,new south wales port stephens shire australia,",Port Stephens Shire,New South Wales,Australia"
35171,victoria northern grampians australia,",Northern Grampians,Victoria,Australia"
35172,victoria greater dandenong australia,",Greater Dandenong,Victoria,Australia"
35173,victoria port phillip australia,",Port Phillip,Victoria,Australia"
35174,new south wales clarence valley australia,",Clarence Valley,New South Wales,Australia"
35175,tasmania sorell australia,",Sorell,Tasmania,Australia"
35176,tasmania circular head australia,",Circular Head,Tasmania,Australia"
35177,new south wales singleton australia,",Singleton,New South Wales,Australia"
35178,victoria greater shepparton australia,",Greater Shepparton,Victoria,Australia"
35179,new south wales shellharbour australia,",Shellharbour,New South Wales,Australia"
35180,tasmania kentish australia,",Kentish,Tasmania,Australia"
35181,victoria ballarat north australia,",Ballarat North,Victoria,Australia"
35182,victoria frankston australia,",Frankston,Victoria,Australia"
35183,tasmania dorset australia,",Dorset,Tasmania,Australia"
35184,victoria wellington australia,",Wellington,Victoria,Australia"
35185,tasmania break o'day australia,",Break O'Day,Tasmania,Australia"
35186,new south wales maitland municipality australia,",Maitland Municipality,New South Wales,Australia"
35187,tasmania west coast australia,",West Coast,Tasmania,Australia"
35188,queensland maranoa australia,",Maranoa,Queensland,Australia"
35189,victoria melton australia,",Melton,Victoria,Australia"
35190,new south wales blacktown australia,",Blacktown,New South Wales,Australia"
35191,victoria maroondah australia,",Maroondah,Victoria,Australia"
35192,victoria yarra australia,",Yarra,Victoria,Australia"
35193,new south wales hawkesbury australia,",Hawkesbury,New South Wales,Australia"
35194,new south wales canada bay australia,",Canada Bay,New South Wales,Australia"
35195,new south wales bankstown australia,",Bankstown,New South Wales,Australia"
35196,victoria darebin australia,",Darebin,Victoria,Australia"
35197,south australia renmark paringa australia,",Renmark Paringa,South Australia,Australia"
35198,queensland whitsunday australia,",Whitsunday,Queensland,Australia"
35199,new south wales lake macquarie shire australia,",Lake Macquarie Shire,New South Wales,Australia"
35200,new south wales liverpool plains australia,",Liverpool Plains,New South Wales,Australia"
35201,victoria queenscliffe australia,",Queenscliffe,Victoria,Australia"
35202,new south wales queanbeyan australia,",Queanbeyan,New South Wales,Australia"
35203,tasmania latrobe australia,",Latrobe,Tasmania,Australia"
35204,new south wales port macquarie-hastings australia,",Port Macquarie-Hastings,New South Wales,Australia"
35205,victoria glenelg australia,",Glenelg,Victoria,Australia"
