Unnamed: 0,name,mapped_data
50222,mississippi franklin county united states,",Franklin County,Mississippi,United States"
50223,mississippi marshall county united states,",Marshall County,Mississippi,United States"
50224,mississippi hinds county united states,",Hinds County,Mississippi,United States"
50225,mississippi lowndes county united states,",Lowndes County,Mississippi,United States"
50226,mississippi madison county united states,",Madison County,Mississippi,United States"
50227,mississippi pearl river county united states,",Pearl River County,Mississippi,United States"
50228,mississippi carroll county united states,",Carroll County,Mississippi,United States"
50229,mississippi leake county united states,",Leake County,Mississippi,United States"
50230,mississippi wilkinson county united states,",Wilkinson County,Mississippi,United States"
50231,mississippi tallahatchie county united states,",Tallahatchie County,Mississippi,United States"
50232,mississippi coahoma county united states,",Coahoma County,Mississippi,United States"
50233,mississippi bolivar county united states,",Bolivar County,Mississippi,United States"
50234,mississippi neshoba county united states,",Neshoba County,Mississippi,United States"
50235,mississippi tate county united states,",Tate County,Mississippi,United States"
50236,mississippi covington county united states,",Covington County,Mississippi,United States"
50237,mississippi lauderdale county united states,",Lauderdale County,Mississippi,United States"
50238,mississippi marion county united states,",Marion County,Mississippi,United States"
50239,mississippi newton county united states,",Newton County,Mississippi,United States"
50240,mississippi alcorn county united states,",Alcorn County,Mississippi,United States"
50241,mississippi copiah county united states,",Copiah County,Mississippi,United States"
50242,mississippi kemper county united states,",Kemper County,Mississippi,United States"
50243,mississippi sunflower county united states,",Sunflower County,Mississippi,United States"
50244,mississippi holmes county united states,",Holmes County,Mississippi,United States"
50245,mississippi jones county united states,",Jones County,Mississippi,United States"
50246,mississippi jackson county united states,",Jackson County,Mississippi,United States"
50247,mississippi webster county united states,",Webster County,Mississippi,United States"
50248,mississippi jefferson county united states,",Jefferson County,Mississippi,United States"
50249,mississippi scott county united states,",Scott County,Mississippi,United States"
50250,mississippi itawamba county united states,",Itawamba County,Mississippi,United States"
50251,mississippi forrest county united states,",Forrest County,Mississippi,United States"
50252,mississippi washington county united states,",Washington County,Mississippi,United States"
50253,mississippi leflore county united states,",Leflore County,Mississippi,United States"
50254,mississippi grenada county united states,",Grenada County,Mississippi,United States"
50255,mississippi de soto county united states,",De Soto County,Mississippi,United States"
50256,mississippi chickasaw county united states,",Chickasaw County,Mississippi,United States"
50257,mississippi attala county united states,",Attala County,Mississippi,United States"
50258,mississippi quitman county united states,",Quitman County,Mississippi,United States"
50259,mississippi greene county united states,",Greene County,Mississippi,United States"
50260,mississippi amite county united states,",Amite County,Mississippi,United States"
50261,mississippi winston county united states,",Winston County,Mississippi,United States"
50262,mississippi george county united states,",George County,Mississippi,United States"
50263,mississippi simpson county united states,",Simpson County,Mississippi,United States"
50264,mississippi pike county united states,",Pike County,Mississippi,United States"
50265,mississippi issaquena county united states,",Issaquena County,Mississippi,United States"
50266,mississippi lawrence county united states,",Lawrence County,Mississippi,United States"
50267,mississippi adams county united states,",Adams County,Mississippi,United States"
50268,mississippi union county united states,",Union County,Mississippi,United States"
50269,mississippi perry county united states,",Perry County,Mississippi,United States"
50270,mississippi tunica county united states,",Tunica County,Mississippi,United States"
50271,mississippi lafayette county united states,",Lafayette County,Mississippi,United States"
50272,mississippi pontotoc county united states,",Pontotoc County,Mississippi,United States"
50273,mississippi claiborne county united states,",Claiborne County,Mississippi,United States"
50274,mississippi jefferson davis county united states,",Jefferson Davis County,Mississippi,United States"
50275,mississippi clarke county united states,",Clarke County,Mississippi,United States"
50276,mississippi smith county united states,",Smith County,Mississippi,United States"
50277,mississippi tippah county united states,",Tippah County,Mississippi,United States"
50278,mississippi sharkey county united states,",Sharkey County,Mississippi,United States"
50279,mississippi oktibbeha county united states,",Oktibbeha County,Mississippi,United States"
50280,mississippi walthall county united states,",Walthall County,Mississippi,United States"
50281,mississippi yalobusha county united states,",Yalobusha County,Mississippi,United States"
50282,mississippi clay county united states,",Clay County,Mississippi,United States"
50283,mississippi stone county united states,",Stone County,Mississippi,United States"
50284,mississippi montgomery county united states,",Montgomery County,Mississippi,United States"
50285,mississippi yazoo county united states,",Yazoo County,Mississippi,United States"
50286,north carolina moore county united states,",Moore County,North Carolina,United States"
50287,north carolina davie county united states,",Davie County,North Carolina,United States"
50288,north carolina hertford county united states,",Hertford County,North Carolina,United States"
50289,north carolina stanly county united states,",Stanly County,North Carolina,United States"
50290,north carolina cherokee county united states,",Cherokee County,North Carolina,United States"
50291,north carolina harnett county united states,",Harnett County,North Carolina,United States"
50292,north carolina wake county united states,",Wake County,North Carolina,United States"
50293,north carolina randolph county united states,",Randolph County,North Carolina,United States"
50294,north carolina johnston county united states,",Johnston County,North Carolina,United States"
50295,north carolina buncombe county united states,",Buncombe County,North Carolina,United States"
50296,north carolina carteret county united states,",Carteret County,North Carolina,United States"
50297,north carolina pitt county united states,",Pitt County,North Carolina,United States"
50298,north carolina mitchell county united states,",Mitchell County,North Carolina,United States"
50299,north carolina henderson county united states,",Henderson County,North Carolina,United States"
50300,north carolina avery county united states,",Avery County,North Carolina,United States"
50301,north carolina pamlico county united states,",Pamlico County,North Carolina,United States"
50302,north carolina new hanover county united states,",New Hanover County,North Carolina,United States"
50303,north carolina beaufort county united states,",Beaufort County,North Carolina,United States"
50304,north carolina gaston county united states,",Gaston County,North Carolina,United States"
50305,north carolina brunswick county united states,",Brunswick County,North Carolina,United States"
50306,north carolina alexander county united states,",Alexander County,North Carolina,United States"
50307,north carolina duplin county united states,",Duplin County,North Carolina,United States"
50308,north carolina montgomery county united states,",Montgomery County,North Carolina,United States"
50309,north carolina bladen county united states,",Bladen County,North Carolina,United States"
50310,north carolina watauga county united states,",Watauga County,North Carolina,United States"
50311,north carolina cleveland county united states,",Cleveland County,North Carolina,United States"
50312,north carolina yadkin county united states,",Yadkin County,North Carolina,United States"
50313,north carolina transylvania county united states,",Transylvania County,North Carolina,United States"
50314,north carolina craven county united states,",Craven County,North Carolina,United States"
50315,north carolina lee county united states,",Lee County,North Carolina,United States"
50316,north carolina wayne county united states,",Wayne County,North Carolina,United States"
50317,north carolina columbus county united states,",Columbus County,North Carolina,United States"
50318,north carolina swain county united states,",Swain County,North Carolina,United States"
50319,north carolina pender county united states,",Pender County,North Carolina,United States"
50320,north carolina alamance county united states,",Alamance County,North Carolina,United States"
50321,north carolina anson county united states,",Anson County,North Carolina,United States"
50322,north carolina yancey county united states,",Yancey County,North Carolina,United States"
50323,north carolina granville county united states,",Granville County,North Carolina,United States"
50324,north carolina dare county united states,",Dare County,North Carolina,United States"
50325,north carolina caldwell county united states,",Caldwell County,North Carolina,United States"
50326,north carolina camden county united states,",Camden County,North Carolina,United States"
50327,north carolina haywood county united states,",Haywood County,North Carolina,United States"
50328,north carolina orange county united states,",Orange County,North Carolina,United States"
50329,north carolina mecklenburg county united states,",Mecklenburg County,North Carolina,United States"
50330,north carolina rowan county united states,",Rowan County,North Carolina,United States"
50331,north carolina catawba county united states,",Catawba County,North Carolina,United States"
50332,north carolina forsyth county united states,",Forsyth County,North Carolina,United States"
50333,north carolina sampson county united states,",Sampson County,North Carolina,United States"
50334,north carolina tyrrell county united states,",Tyrrell County,North Carolina,United States"
50335,north carolina polk county united states,",Polk County,North Carolina,United States"
50336,north carolina cabarrus county united states,",Cabarrus County,North Carolina,United States"
50337,north carolina burke county united states,",Burke County,North Carolina,United States"
50338,north carolina richmond county united states,",Richmond County,North Carolina,United States"
50339,north carolina wilkes county united states,",Wilkes County,North Carolina,United States"
50340,north carolina jackson county united states,",Jackson County,North Carolina,United States"
50341,north carolina currituck county united states,",Currituck County,North Carolina,United States"
50342,north carolina stokes county united states,",Stokes County,North Carolina,United States"
50343,north carolina davidson county united states,",Davidson County,North Carolina,United States"
50344,north carolina lincoln county united states,",Lincoln County,North Carolina,United States"
50345,north carolina surry county united states,",Surry County,North Carolina,United States"
50346,north carolina durham county united states,",Durham County,North Carolina,United States"
50347,north carolina cumberland county united states,",Cumberland County,North Carolina,United States"
50348,north carolina rockingham county united states,",Rockingham County,North Carolina,United States"
50349,north carolina chowan county united states,",Chowan County,North Carolina,United States"
50350,north carolina pasquotank county united states,",Pasquotank County,North Carolina,United States"
50351,north carolina wilson county united states,",Wilson County,North Carolina,United States"
50352,north carolina halifax county united states,",Halifax County,North Carolina,United States"
50353,north carolina robeson county united states,",Robeson County,North Carolina,United States"
50354,north carolina union county united states,",Union County,North Carolina,United States"
50355,north carolina chatham county united states,",Chatham County,North Carolina,United States"
50356,north carolina rutherford county united states,",Rutherford County,North Carolina,United States"
50357,north carolina guilford county united states,",Guilford County,North Carolina,United States"
50358,north carolina macon county united states,",Macon County,North Carolina,United States"
50359,north carolina franklin county united states,",Franklin County,North Carolina,United States"
50360,north carolina northampton county united states,",Northampton County,North Carolina,United States"
50361,north carolina gates county united states,",Gates County,North Carolina,United States"
50362,north carolina onslow county united states,",Onslow County,North Carolina,United States"
50363,north carolina clay county united states,",Clay County,North Carolina,United States"
50364,north carolina vance county united states,",Vance County,North Carolina,United States"
50365,north carolina perquimans county united states,",Perquimans County,North Carolina,United States"
50366,north carolina ashe county united states,",Ashe County,North Carolina,United States"
50367,north carolina lenoir county united states,",Lenoir County,North Carolina,United States"
50368,north carolina scotland county united states,",Scotland County,North Carolina,United States"
50369,north carolina mcdowell county united states,",McDowell County,North Carolina,United States"
50370,north carolina madison county united states,",Madison County,North Carolina,United States"
50371,north carolina greene county united states,",Greene County,North Carolina,United States"
50372,north carolina jones county united states,",Jones County,North Carolina,United States"
50373,north carolina iredell county united states,",Iredell County,North Carolina,United States"
50374,north carolina nash county united states,",Nash County,North Carolina,United States"
50375,north carolina warren county united states,",Warren County,North Carolina,United States"
50376,north carolina edgecombe county united states,",Edgecombe County,North Carolina,United States"
50377,north carolina washington county united states,",Washington County,North Carolina,United States"
50378,north carolina hoke county united states,",Hoke County,North Carolina,United States"
50379,north carolina graham county united states,",Graham County,North Carolina,United States"
50380,north carolina martin county united states,",Martin County,North Carolina,United States"
50381,north carolina person county united states,",Person County,North Carolina,United States"
50382,north carolina alleghany county united states,",Alleghany County,North Carolina,United States"
50383,north carolina hyde county united states,",Hyde County,North Carolina,United States"
50384,north carolina bertie county united states,",Bertie County,North Carolina,United States"
50385,north carolina caswell county united states,",Caswell County,North Carolina,United States"
50386,new jersey atlantic county united states,",Atlantic County,New Jersey,United States"
50387,new jersey salem county united states,",Salem County,New Jersey,United States"
50388,new jersey camden county united states,",Camden County,New Jersey,United States"
50389,new jersey cape may county united states,",Cape May County,New Jersey,United States"
50390,new jersey ocean county united states,",Ocean County,New Jersey,United States"
50391,new jersey gloucester county united states,",Gloucester County,New Jersey,United States"
50392,new jersey cumberland county united states,",Cumberland County,New Jersey,United States"
50393,new jersey burlington county united states,",Burlington County,New Jersey,United States"
50394,ohio brown county united states,",Brown County,Ohio,United States"
50395,ohio clermont county united states,",Clermont County,Ohio,United States"
50396,ohio darke county united states,",Darke County,Ohio,United States"
50397,ohio pickaway county united states,",Pickaway County,Ohio,United States"
50398,ohio athens county united states,",Athens County,Ohio,United States"
50399,ohio fairfield county united states,",Fairfield County,Ohio,United States"
50400,ohio belmont county united states,",Belmont County,Ohio,United States"
50401,ohio greene county united states,",Greene County,Ohio,United States"
50402,ohio butler county united states,",Butler County,Ohio,United States"
50403,ohio washington county united states,",Washington County,Ohio,United States"
50404,ohio madison county united states,",Madison County,Ohio,United States"
50405,ohio franklin county united states,",Franklin County,Ohio,United States"
50406,ohio clinton county united states,",Clinton County,Ohio,United States"
50407,ohio montgomery county united states,",Montgomery County,Ohio,United States"
50408,ohio licking county united states,",Licking County,Ohio,United States"
50409,ohio lawrence county united states,",Lawrence County,Ohio,United States"
50410,ohio guernsey county united states,",Guernsey County,Ohio,United States"
50411,ohio noble county united states,",Noble County,Ohio,United States"
50412,ohio preble county united states,",Preble County,Ohio,United States"
50413,ohio warren county united states,",Warren County,Ohio,United States"
50414,ohio perry county united states,",Perry County,Ohio,United States"
50415,ohio clark county united states,",Clark County,Ohio,United States"
50416,ohio ross county united states,",Ross County,Ohio,United States"
50417,ohio scioto county united states,",Scioto County,Ohio,United States"
50418,ohio gallia county united states,",Gallia County,Ohio,United States"
50419,ohio highland county united states,",Highland County,Ohio,United States"
50420,ohio jackson county united states,",Jackson County,Ohio,United States"
50421,ohio fayette county united states,",Fayette County,Ohio,United States"
50422,ohio hocking county united states,",Hocking County,Ohio,United States"
50423,ohio adams county united states,",Adams County,Ohio,United States"
50424,ohio vinton county united states,",Vinton County,Ohio,United States"
50425,ohio morgan county united states,",Morgan County,Ohio,United States"
50426,ohio meigs county united states,",Meigs County,Ohio,United States"
50427,ohio muskingum county united states,",Muskingum County,Ohio,United States"
50428,ohio pike county united states,",Pike County,Ohio,United States"
50429,ohio miami county united states,",Miami County,Ohio,United States"
50430,ohio monroe county united states,",Monroe County,Ohio,United States"
50431,oklahoma pontotoc county united states,",Pontotoc County,Oklahoma,United States"
50432,oklahoma ottawa county united states,",Ottawa County,Oklahoma,United States"
50433,oklahoma jackson county united states,",Jackson County,Oklahoma,United States"
50434,oklahoma woods county united states,",Woods County,Oklahoma,United States"
50435,oklahoma caddo county united states,",Caddo County,Oklahoma,United States"
50436,oklahoma pushmataha county united states,",Pushmataha County,Oklahoma,United States"
50437,oklahoma custer county united states,",Custer County,Oklahoma,United States"
50438,oklahoma carter county united states,",Carter County,Oklahoma,United States"
50439,oklahoma le flore county united states,",Le Flore County,Oklahoma,United States"
50440,oklahoma ellis county united states,",Ellis County,Oklahoma,United States"
50441,oklahoma atoka county united states,",Atoka County,Oklahoma,United States"
50442,oklahoma osage county united states,",Osage County,Oklahoma,United States"
50443,oklahoma washington county united states,",Washington County,Oklahoma,United States"
50444,oklahoma okmulgee county united states,",Okmulgee County,Oklahoma,United States"
50445,oklahoma oklahoma county united states,",Oklahoma County,Oklahoma,United States"
50446,oklahoma pottawatomie county united states,",Pottawatomie County,Oklahoma,United States"
50447,oklahoma tulsa county united states,",Tulsa County,Oklahoma,United States"
50448,oklahoma kay county united states,",Kay County,Oklahoma,United States"
50449,oklahoma mcclain county united states,",McClain County,Oklahoma,United States"
50450,oklahoma okfuskee county united states,",Okfuskee County,Oklahoma,United States"
50451,oklahoma stephens county united states,",Stephens County,Oklahoma,United States"
50452,oklahoma creek county united states,",Creek County,Oklahoma,United States"
50453,oklahoma mccurtain county united states,",McCurtain County,Oklahoma,United States"
50454,oklahoma harper county united states,",Harper County,Oklahoma,United States"
50455,oklahoma washita county united states,",Washita County,Oklahoma,United States"
50456,oklahoma rogers county united states,",Rogers County,Oklahoma,United States"
50457,oklahoma comanche county united states,",Comanche County,Oklahoma,United States"
50458,oklahoma bryan county united states,",Bryan County,Oklahoma,United States"
50459,oklahoma lincoln county united states,",Lincoln County,Oklahoma,United States"
50460,oklahoma mcintosh county united states,",McIntosh County,Oklahoma,United States"
50461,oklahoma alfalfa county united states,",Alfalfa County,Oklahoma,United States"
50462,oklahoma roger mills county united states,",Roger Mills County,Oklahoma,United States"
50463,oklahoma grady county united states,",Grady County,Oklahoma,United States"
50464,oklahoma mayes county united states,",Mayes County,Oklahoma,United States"
50465,oklahoma delaware county united states,",Delaware County,Oklahoma,United States"
50466,oklahoma pawnee county united states,",Pawnee County,Oklahoma,United States"
50467,oklahoma wagoner county united states,",Wagoner County,Oklahoma,United States"
50468,oklahoma logan county united states,",Logan County,Oklahoma,United States"
50469,oklahoma payne county united states,",Payne County,Oklahoma,United States"
50470,oklahoma murray county united states,",Murray County,Oklahoma,United States"
50471,oklahoma canadian county united states,",Canadian County,Oklahoma,United States"
50472,oklahoma beckham county united states,",Beckham County,Oklahoma,United States"
50473,oklahoma garfield county united states,",Garfield County,Oklahoma,United States"
50474,oklahoma major county united states,",Major County,Oklahoma,United States"
50475,oklahoma muskogee county united states,",Muskogee County,Oklahoma,United States"
50476,oklahoma tillman county united states,",Tillman County,Oklahoma,United States"
50477,oklahoma blaine county united states,",Blaine County,Oklahoma,United States"
50478,oklahoma greer county united states,",Greer County,Oklahoma,United States"
50479,oklahoma cleveland county united states,",Cleveland County,Oklahoma,United States"
50480,oklahoma pittsburg county united states,",Pittsburg County,Oklahoma,United States"
50481,oklahoma kingfisher county united states,",Kingfisher County,Oklahoma,United States"
50482,oklahoma kiowa county united states,",Kiowa County,Oklahoma,United States"
50483,oklahoma hughes county united states,",Hughes County,Oklahoma,United States"
50484,oklahoma harmon county united states,",Harmon County,Oklahoma,United States"
50485,oklahoma choctaw county united states,",Choctaw County,Oklahoma,United States"
50486,oklahoma marshall county united states,",Marshall County,Oklahoma,United States"
50487,oklahoma seminole county united states,",Seminole County,Oklahoma,United States"
50488,oklahoma garvin county united states,",Garvin County,Oklahoma,United States"
50489,oklahoma love county united states,",Love County,Oklahoma,United States"
50490,oklahoma grant county united states,",Grant County,Oklahoma,United States"
50491,oklahoma woodward county united states,",Woodward County,Oklahoma,United States"
50492,oklahoma sequoyah county united states,",Sequoyah County,Oklahoma,United States"
50493,oklahoma nowata county united states,",Nowata County,Oklahoma,United States"
50494,oklahoma cherokee county united states,",Cherokee County,Oklahoma,United States"
50495,oklahoma noble county united states,",Noble County,Oklahoma,United States"
50496,oklahoma jefferson county united states,",Jefferson County,Oklahoma,United States"
50497,oklahoma haskell county united states,",Haskell County,Oklahoma,United States"
50498,oklahoma adair county united states,",Adair County,Oklahoma,United States"
50499,oklahoma dewey county united states,",Dewey County,Oklahoma,United States"
50500,oklahoma cotton county united states,",Cotton County,Oklahoma,United States"
50501,oklahoma johnston county united states,",Johnston County,Oklahoma,United States"
50502,oklahoma craig county united states,",Craig County,Oklahoma,United States"
50503,oklahoma latimer county united states,",Latimer County,Oklahoma,United States"
50504,pennsylvania adams county united states,",Adams County,Pennsylvania,United States"
50505,pennsylvania delaware county united states,",Delaware County,Pennsylvania,United States"
50506,pennsylvania chester county united states,",Chester County,Pennsylvania,United States"
50507,pennsylvania somerset county united states,",Somerset County,Pennsylvania,United States"
50508,pennsylvania franklin county united states,",Franklin County,Pennsylvania,United States"
50509,pennsylvania lancaster county united states,",Lancaster County,Pennsylvania,United States"
50510,pennsylvania york county united states,",York County,Pennsylvania,United States"
